AppID,Nombre,Tipo,Descripcion,Desarrollador,Editor,FechaSalida,Genero,Categoria,Lenguajes,Gratis,EdadRequerida,Moneda,PrecioInicial,Plataforma
2626860,Dragon Eclipse,game,Choose your Tamer and fight dangerous creatures with your companions - powerful Mystlings! Travel the mysterious world of Dragon Eclipse. Catch and train Mystlings to put together your own team! Build a strong card deck and create efficient synergies of three Mystlings to fight your enemies.,Fardust,Awaken Realms,"24 Jun, 2024",Strategy,Multi-player,English,No,0,USD,12.99,linux
2618940,Desktop Pet Project,game,"Elevate your PC experience with charming desktop pets. Inspired by such a wonderful invention as Shimeji, Desktop Pet Project has tried to collect the most interesting and curious mechanics. You can summon up to two pets that will have slight personalities in behavior.",Alterran Rumble,Alterran Rumble,"26 Oct, 2023",Strategy,Local Multi-Player,English,No,0,USD,2.99,windows
2656330,Meta Soulmate,game,"Create your own virtual mate with a game-style character customization tool. Debut your ideal as a VTuber, or make it your own secret friend. Create your meta soulmate now!",ONEUNIVERSE Co. Ltd.,ONEUNIVERSE Co. Ltd.,"1 Nov, 2024",RPG,Single-player,English,Si,0,,0.00,mac
2697790,Automobilista 2 - Circuit des 24 Heures du Mans,dlc,The mecca of Endurance racing arrives to AMS2! Modelled with the aid of detailed laser scan data this DLC features the modern 24h track along with its shorter Bugatti layout.,Reiza Studios,,"5 Jan, 2024",Casual,Local Multi-Player,English,No,0,USD,9.99,mac
2729480,NightClub Simulator,game,"seduce girl or get into fight, you can do anythings in virtual night club that you can't do in real life.",mandegames,mandegames,"26 Feb, 2024",Adventure,Local Multi-Player,English,No,0,USD,4.99,windows
2775910,Infinite Blue,game,"Discover an immersive ocean Eco-Sim where you can be almost any animal under the sea! From a tiny seahorse to a massive blue whale, experience the endless circle of life in a massive world of reefs, shipwrecks, and hidden wonders.",Gluten Free Games,Gluten Free Games,"30 Sep, 2024",Casual,Local Multi-Player,English,Si,0,,0.00,linux
2810780,Forsaken Frontiers,game,"Step into the frozen unknown in Forsaken Frontiers, a cooperative analog horror adventure set in the unforgiving embrace of an everlasting winter.",made in fairyland,made in fairyland,"21 Oct, 2024",Adventure,Co-op,English,No,0,USD,14.99,windows
2838550,The Monarch: First Light,game,"Will you be the savior to purify this land? The Monarch is a lane-defense game where you control a monarch, expand your kingdom, and defend against evil by strategically managing gold resources, recruiting diverse units, and exploring a world filled with mythical threats.",Citadel Games,Citadel Games,"3 Apr, 2024",Action,Co-op,English,Si,0,,0.00,mac
2843410,Everloop,game,You are trapped in an endless hallway. Observe your surroundings carefully to reach your destiny.,Infinity Green Game Studio,Infinity Green Game Studio,"6 Mar, 2024",Casual,Local Multi-Player,English,No,0,USD,4.99,mac
1208110,Prometheus Wept,game,"Prometheus Wept is a party and action point turn based RPG set in a near-future, post-digital Earth. The game offers hardcore squad-level combat, simultaneous battles between cyberspace and the physical world, meaningful choices, deep character progression and an advanced crafting system.",Timeslip Softworks,Timeslip Softworks,To be announced,Casual,Single-player,English,No,0,To be announced,To be announced,linux
1779000,Dynamic Dungeons Editor Demo,demo,,Dynamic Dungeons,Dynamic Dungeons,"31 Oct, 2021",Adventure,Online Multi-Player,English,Si,0,,0.00,mac
1074830,Alcyone: The Last City,game,"Alcyone: The Last City is an interactive sci-fi novel where your choices can lead to the salvation or destruction of the last refuge of civilisation in the universe. Immerse yourself in a branching narrative of diverse characters, intrigue, and world-altering decisions.",Joshua Meadows,Joshua Meadows,Coming soon,Action,Multi-player,English,No,0,Coming soon,Coming soon,linux
2519240,Feywing,game,"Feywing is a short game loosely inspired by classic internet ritual stories. You must memorize and navigate the strange environment of the Crossroads to collect materials for the ritual, and escape the Crossroads. During all of this, the whimsical Feywing will be there to guide you along.",Dinoleaf LLC,Dinoleaf LLC,"31 Oct, 2023",Adventure,Online Multi-Player,English,Si,0,,0.00,windows
1694430,Dynamic Dungeons Editor,game,"Dynamic Dungeons Editor is an easy-to-use local tabletop tool for game masters to display video maps or images on a digital gaming table, TV, or projector. Import Dynamic Dungeons maps or your own images or videos, use tokens and props. Make a playlist, apply fog of war, or a custom grid overlay.",Dynamic Dungeons,Dynamic Dungeons,"1 Aug, 2022",Casual,Single-player,English,No,0,USD,29.99,linux
1761210,The Touhou Empires,game,"Touhou meets real-time warfare! Explore maps, gather resources, and build your army! Become the conqueror of Gensokyo!",Neetpia,Phoenixx Inc.,2025,Casual,Online Multi-Player,English,No,0,,,linux
2493070,Vulture -Unlimited Frontier- /0 体験版 Demo,demo,"This is an action game in which the player builds and controls a giant robot. The game features ground crawling 3D maneuvers, customizable elements, picturesque characters, and scenarios. Even those who have never been good at action games will surely find that Vulture will respond to their needs.",濡れ路,濡れ路,"14 Jul, 2023",RPG,Local Multi-Player,English,Si,0,,0.00,mac
3070350,Danger and Deadlier,game,Danger and Deadlier is a hardcore medieval fantasy dungeon adventure game. Join intense 6v6v6 battles with different classes. Dungeon-style exploration lets you find valuable treasures. What are you waiting for? Join this gold rush now!&quot;,Dog On God,Dog On God,"13 Jul, 2024",RPG,Co-op,English,No,0,USD,2.99,mac
3135900,Dawn of Survivor,game,"A third-person survivor roguelike game where waves of zombies come at you. By killing them, you get random opportunities to acquire equipment, weapons, and new skills. You can have up to 8 skills, giving you immense power. Come and see how far you can go!",Dog On God,Dog On God,"15 Aug, 2024",Indie,Single-player,English,No,0,USD,2.99,windows
3070340,Escape From Clive,game,"Escape From Clive is a simulated real war evacuation computer game. Successfully evacuating to safety zone is your ultimate goal. Players would go into the Clive and come back with fruitful supplies. Remember that if you are ambushed, you will lose everything.",Dog On God,Dog On God,"18 Jul, 2024",Action,Single-player,English,No,0,USD,2.99,linux
3025600,Bishojo Battlefield,game,"A funny shooting game where you can customize the gameplay, such as zombies holding submachine guns and shooting aliens, or wolf dogs holding samurai swords and fighting special forces in close combat... How unexpected the settings will be depends on your imagination.",Dog On God,Dog On God,"20 Jun, 2024",Indie,Co-op,English,No,0,USD,2.99,windows
2587400,BARA Labs,game,BARA Labs is a short collection of experimental prototype games made by our team. We will decide whether or not to make a full-length game out of the shorts based on how the prototypes are received by the players.,Barasia Games,Barasia Games,"12 Oct, 2024",Strategy,Local Multi-Player,English,Si,0,,0.00,linux
3057400,Zombie War:New World,game,&quot;Zombie World War: New World&quot; is a shooter where players and three AI teammates battle a massive zombie invasion. They must cooperate using skills and strategies to survive and defeat mutants. Intense combat with high-quality graphics and PBR materials providing a visually stunning experience.,Dog On God,Dog On God,"4 Jul, 2024",RPG,Multi-player,English,No,0,USD,2.99,mac
3135880,Dragon's Dog mother,game,"A hilarious medieval fantasy adventure with an epic world that will immerse you. Strange and diverse monsters let you build a unique team, while the funny yet profound storyline will make you laugh and ponder.",Dog On God,Dog On God,"Nov 13, 2024",Strategy,Single-player,English,No,0,USD,2.99,windows
2180040,Legacy's Allure,game,"Legacy's Allure is a customizable, card-based wargame with no randomness. Command warriors, beasts, and mages on the battlefield to outplay your opponent in this chess-inspired fantasy battle.",Plutonian Shore Games LLC,Plutonian Shore Games LLC,Coming soon,Casual,Co-op,English,Si,0,Coming soon,0.00,mac
2396240,SteamWorld Heist II,game,"Join Captain Leeway on the biggest Heist yet to save botkind from a brewing water crisis! With tactical turn-based battles featuring signature ricochet action, 150+ weapons and items, a new job system, real-time naval combat and 30+ hours of gameplay, prepare for an epic SteamWorld adventure!",Thunderful Development,Thunderful Publishing,"8 Aug, 2024",Indie,Single-player,English,No,0,USD,29.99,mac
3306110,Kiana & Biscuit - Pirates on a Visit! Demo,demo,,"Spicyfuse, Cakesin",Cakesin,"30 Nov, 2024",Casual,Local Multi-Player,English,Si,0,,0.00,windows
1147690,NGU IDLE,game,"NGU Idle is a Free To Play Idle game that's full of weird humor, tons of upgrades and hundreds of hours of content! Try out NGU Idle today and experience the joy of Numbers Going Up!",4G,4G,"1 Oct, 2019",Strategy,Online Multi-Player,English,Si,0,,0.00,mac
1207650,Suzerain,game,"Assume the role of President Anton Rayne and guide the nation of Sordland. Amidst brewing international conflicts, need for reform, deep-seated corruption, and economic recession, you must make the decisions in this political drama. How will you lead?",Torpor Games,"Torpor Games, Fellow Traveller","4 Dec, 2020",Indie,Co-op,English,No,0,USD,19.99,linux
2141730,Backrooms: Escape Together,game,"A visually lifelike 1-6 player co-op survival horror made in Unreal Engine 5. Explore 7 procedurally generated levels that host liminal environments, puzzles, and entities with new levels and content added regularly. You are at the mercy of what's lurking and must do whatever it takes to escape.",Triiodide Studios,Triiodide Studios,"18 Oct, 2022",Action,Single-player,English,No,0,USD,7.99,mac
1898920,War of the Worlds,game,"Hardcore horror open world survival game which throws the player into the middle of the extermination of mankind with the sole purpose of surviving long enough to find a way to bring down the alien machines. Loot buildings, fight off hostile survivors, stay hidden from the machines, and stay alive.",FlipSwitch Games,FlipSwitch Games,To be announced,Strategy,Online Multi-Player,English,No,0,To be announced,To be announced,windows
2555260,Rage Simulator,game,"Rage Simulator is a minimalist hand-drawn beat-em-up simulator. I made this little game for myself and for you guys, I just wanted to beat something up.",Liujiajun, Liujiajun,"17 Jul, 2024",Action,Co-op,English,Si,0,,0.00,windows
2642210,Slay the Princess - Supporters Pack,dlc,The Slay the Princess OST and over 160 HD Wallpapers. Buy this if you want to further support the developers!,Black Tabby Games,,"27 Oct, 2023",RPG,Multi-player,English,No,0,USD,9.99,mac
2797180,咫尺遥心-Proof of existence,game,即使存在相同的目的，每个人也会有各自的实现方式，理念背道而驰的两人，就算共处一室，也始终无法理解对方。 能跨越这道鸿沟的，就只有……,"置雨制作组, 龍之咲",LoveStoryProject,"6 Aug, 2024",Indie,Local Multi-Player,English,No,0,USD,2.99,windows
3000910,Defender's Squad: The Last Ride,game,Defender's Squad is a sci-fi vertical scrolling shooter 2D that combines 7 different levels. Play Solo and pick one of the 3 ships to kill enemies and save the earth from aliens.,"JMC, CLC","JMC, CLC",Coming soon,Indie,Multi-player,English,No,0,Coming soon,Coming soon,windows
2743970,One-inch Tactics,game,"Turn the tide of the war with nuanced strategies in One-inch Tactics, introducing players to a unique turn-based strategy experience.",KOGADO STUDIO,KOMODO,"19 May, 2024",Casual,Local Multi-Player,English,No,0,USD,19.99,linux
3288080,Cave Of Horrors Demo,demo,"Explore and discover the secrets of a non-linear cave. Document everything you find in your logbook. You cannot return unless you find every single information about every monster, plant, ore and point of interest.",Maiku_Dev,Maiku_Dev,"8 Nov, 2024",Action,Online Multi-Player,English,Si,0,,0.00,linux
2814060,Skulltide,game,"Skeletal mischief reigns as the Skulltide begins! Join the undead in co-op adventures as the skeleton of your dreams, or lead them yourself, and hunt down the necromancers who reanimated you. Build, throw, and enchant your bones... but try not to misplace them along the way!",ThePlanarDanse,ThePlanarDanse,"28 Oct, 2024",Indie,Online Multi-Player,English,No,0,USD,12.99,linux
3340110,hotland,game,"Hot Land is a RPG that combines automoated production and tower defense.Freely build defense and production buildings within a limited map, develop their own industries.or contend with the major faction on the battlefield and make a fortune from the war.",AdamasZ,AdamasZ,Coming soon,Adventure,Local Multi-Player,English,No,0,Coming soon,Coming soon,linux
552620,ATOM RPG: Post-apocalyptic indie game,game,"ATOM RPG is a post-apocalyptic indie game, inspired by classic CRPGs: Fallout, Wasteland, Deus Ex, Baldur's Gate and many others.",AtomTeam,AtomTeam,"Dec 19, 2018",Action,Online Multi-Player,English,No,0,USD,14.99,windows
3370260,White Room: Mind’s Prison,game,Don't Look at It! White room is a psychological horror game where you'll survive in a white room as long as possible. You'll die of fear if you look at It. Avoid them and protect yourself..,Manja Studio,Manja Studio,Q1 2025,Casual,Online Multi-Player,English,No,0,,,linux
813530,FPV Freerider Recharged,game,"RC Quadcopter Racing Simulator - Fly (and crash!) all you want regardless of the weather, all for the price of a few replacement props.",John Holmvall,Jord&Eld,"17 Mar, 2018",Casual,Local Multi-Player,English,No,0,USD,9.99,linux
1065100,Golden Treasure: The Great Green,game,"Golden Treasure is a game for those who carry dragons in their hearts. Hunt, explore, survive, and become Great among the True Children of Sun and Earth.",Dreaming Door Studios,Dreaming Door Studios,"17 Jun, 2019",Casual,Online Multi-Player,English,No,0,USD,19.99,windows
1330000,Stolen Realm,game,"Stolen Realm is a simultaneous turn-based tactical dungeon crawling looter with action RPG elements where you control up to 6 heroes, solo or through online co-op, venturing forth in adventures set in a high-fantasy, low-poly world.",Burst2Flame Entertainment,Burst2Flame Entertainment,"8 Mar, 2024",Indie,Co-op,English,No,0,USD,19.99,linux
1296830,暖雪 Warm Snow,game,"'Warm Snow' is a Rogue-like action game with a background set in a dark fantasy world, where the eerie 'Warm Snow' holds sway. You will play as the Warrior 'Bi-an' on a crusade against the Five Great Clans, in order to save a world teetering on the brink of destruction.",BadMudStudio,bilibili,"18 Jan, 2022",Strategy,Multi-player,English,No,0,USD,17.99,linux
1302240,Labyrinthine,game,"A co-op horror game like no other... Play with 1-4 players online as you solve puzzles, collect items and run from the horrors that lie within. Follow in the footsteps of Joan in the story mode or tackle procedurally generated maps that scale with your level and bring a fresh experience each game..",Valko Game Studios,Valko Game Studios,"18 Aug, 2023",Indie,Multi-player,English,No,0,USD,9.99,mac
2724550,XXXXXXXXXXXXXXXX,game,"An unemployed young man came back to the town where he grew up, the town has not changed much since he was a child, and he has left his good youth in the big city, while he is still single and poor, so he regains his confidence and is determined to build for the prosperity of his hometown.","BIGNERVEGAME, BIGNERVEGAME",BIGNERVEGAME,"7 Nov, 2024",Strategy,Multi-player,English,No,0,USD,1.99,linux
2616750,Witchhammer,game,"Massacre hordes of enemies and destroy the inquisition in our brutal real-time deckbuilding roguelike. Your future lies in the cards, witch!",Dayshift,Dayshift,To be announced,RPG,Local Multi-Player,English,No,0,To be announced,To be announced,mac
3127380,The Big Adventure,game,"Explore an entire fantasy world, explore Cat City the beating heart of cats, defeat small or huge bosses, also remember to give Astra some cookies or a cup of Tè before you leave.",Mattia54,Mattia54,"18 Oct, 2024",Strategy,Co-op,English,Si,0,,0.00,linux
3146610,"Spiritual Bond ~Breaking the curse, Intertwining fates~",game,"“Anyone who is destined, please help us....” A text-based puzzle game themed around shrine Miko. Explore an abandoned village, ancient and mysterious shrines, and eerie sacrificial rituals by combining nouns and verbs. Gradually uncover the truth hidden behind the story.",MONRA,LoveStoryProject,Q1 2025,Casual,Local Multi-Player,English,No,0,,,linux
311840,Wildlife Park,game,"Build and manage your own wildlife compound, determine which animals to feature, how to manage the business while ensuring that all the animals are thriving. • Build a giant animal park from scratch and manage it well • Choose a variety of terrains with different climates and environmental sounds • 45 detailed, seamlessly animated and...",b-alive gmbh,b-alive gmbh,"1 Apr, 2015",Adventure,Co-op,English,No,0,USD,6.99,mac
319170,Disney G-Force,game,"G-Force draws you into the adventures of an elite team of trained guinea pigs on a mission to thwart a sinister plot to destroy the world. Take control of both G-Force commander Darwin and his sidekick, Mooch, as they apply their talents to defeat an evil army of altered household appliances.",Eurocom,Disney,"6 Oct, 2014",Casual,Local Multi-Player,English,No,0,USD,19.99,windows
3347860,WOOL,game,Swing through urban landscapes using a needle and your wool as a grappling hook to stop the environmental pollution from ruining your peaceful island life - as fluffy sheep do.,tonacapi,tonacapi,2025,Action,Co-op,English,No,0,,,linux
3370270,Backrooms,game,"Survive relentless entities, solve mind-bending puzzles, and uncover the dark secrets of your surroundings. With an XP system, crafting, and resource management, every decision matters. Will you find your way out—or become another lost soul?",Happy Doggo Studios,Happy Doggo Studios,2025,Casual,Single-player,English,Si,0,,0.00,windows
377190,Pale Echoes,game,"An RPG of exploration, collection, and critical thinking. The end of the world has come and gone, leaving only phantoms where once there was life. Now Schorl, the last surviving human, and Spinel, the last of the magical saerii, search through the memories of a bygone era, hoping to find a future.",Wyrmling Productions,KOMODO,"10 Dec, 2015",RPG,Local Multi-Player,English,No,0,USD,4.99,mac
493540,Figment,game,"Figment is an action-adventure game that invites you to explore a unique surreal universe filled with music, humor and multi layered narrative. Join Dusty and his ever-optimistic friend, Piper, on an adventure through the different sides of the mind seeking to restore the courage that's been lost.",Bedtime Digital Games,Bedtime Digital Games,"22 Sep, 2017",Adventure,Online Multi-Player,English,No,0,USD,19.99,mac
601710,Little Nightmares – Original Soundtrack,dlc,Take a step closer to the world of Little Nightmares with this copy of the original soundtrack composed by Tobias Lilja.,Tarsier Studios,BANDAI NAMCO Entertainment,"27 Apr, 2017",Casual,Single-player,English,No,0,USD,4.99,linux
650880,Beyond the Invisible: Evening,game,"At the edge of the forest lies a small Woodville town. One day the town became shrouded in mist and no one could pass through. Citizens began to disappear, one by one and fear gripped the town. Unravel the mystery of the Shadows and free the town from their dreadful fears!",Graphium Studio,Graphium Studio,"22 Jun, 2017",Adventure,Multi-player,English,No,0,USD,7.99,mac
922450,4X-Galaxy 无主之地：银河,game,“4X-Galaxy” is a game developed by the 4X concept system(eXplore、eXpand、eXploit、eXterminate),Mercator,Mercator,"20 Dec, 2018",Casual,Local Multi-Player,English,Si,0,,0.00,windows
818320,LEGO® The Incredibles,game,"Experience the thrilling adventures of the Parr family as they conquer crime and family life through both Disney-Pixar films The Incredibles and Incredibles 2, in a LEGO® world full of fun and humor.","TT Games, Feral Interactive (Mac)","Warner Bros. Interactive Entertainment, Feral Interactive (Mac)","15 Jun, 2018",Adventure,Single-player,English,No,0,USD,39.99,windows
2789680,Hello Neighbor 3,game,"A cozy yet eerie adventure, where every path is the right one, and every action leads to discovery. Explore and influence Raven Brooks, a half-abandoned town simulated in real-time.","Nikita Kolesnikov, tinyBuild",tinyBuild,To be announced,Adventure,Local Multi-Player,English,No,0,To be announced,To be announced,mac
1774580,STAR WARS Jedi: Survivor™,game,"The story of Cal Kestis continues in STAR WARS Jedi: Survivor™, a galaxy-spanning, third-person, action-adventure game.",Respawn,Electronic Arts,"27 Apr, 2023",RPG,Co-op,English,No,0,USD,69.99,mac
2930120,愤怒的孙子们,game,国产FPS巅疯制作...,李鸡蛋,李鸡蛋,"6 Jun, 2024",Action,Local Multi-Player,English,No,0,USD,0.99,mac
3298080,Neon Spellstorm,game,"Neon Spellstorm is an action roguelite where you race along a crumbling neon path as a powerful wizard, wielding limitless magic. Unleash devastating spells, stack wild synergies, and reshape a destructible, otherworldly terrain that falls away behind you!",TopCog,TopCog,2025,Strategy,Multi-player,English,No,0,,,windows
3345880,Dungeon Rummage - Survival,game,"Dungeon Rummage - Survival is a bite-sized, Survival-lite, Turn-based Dungeon crawler with a cozy vibe.",Simple Gaming,Simple Gaming,Coming soon,RPG,Online Multi-Player,English,No,0,Coming soon,Coming soon,linux
3376640,Synthwave Tunnel,game,"Take a late-night ride in Synthwave Tunnel! Race through neon-lit, rhythm-generated paths, pushing your reflexes to the limit. Speed through dynamic obstacles, synced to the beat, and conquer the ultimate challenge. Can you reach the end?",Hard Shark Games,Hard Shark Games,Coming soon,Strategy,Co-op,English,No,0,Coming soon,Coming soon,linux
3362940,WordBlast,game,"A thrilling twist on classic word games! Plan your move, secretly plant bombs and watch the fun explode as opponents trigger your traps. Cross their booby-trapped words, and their hard work goes boom! Use your bomb to clear obstacles or sabotage rivals—every turn is a blast in this word puzzler!",Palatine Games,Palatine Games,Coming soon,Adventure,Multi-player,English,No,0,Coming soon,Coming soon,windows
519140,Minds Eyes,game,"You venture through your mind, trying desperately to wake up from your nightmares. Will you make it out?",Stanislaw Truchowski,TurnVex,"31 Aug, 2016",Indie,Multi-player,English,Si,0,,0.00,mac
3354920,Midpoint,game,"Midpoint is a 2D Metroidvania with RPG elements. Destroy, dodge, and steal spiritual energy from your foes. Be possessed by spirits of light and darkness to gain unique upgrades, sacrifice certain traits to unlock greater power. Free the world before being consumed by darkness.",Frandy,Frandy,Coming soon,Action,Multi-player,English,No,0,Coming soon,Coming soon,mac
701180,The Escapists 2 - Season Pass,dlc,"Get access to exciting additional content for The Escapists 2 with the season pass. Test your escaping expertise by breaking out of three exhilarating new prisons with extra items, customisations and thrilling new ways to escape!","Team17 Digital Ltd, Mouldy Toof Studios",,"21 Aug, 2017",Casual,Local Multi-Player,English,No,0,USD,9.99,windows
878440,Fantasy Ball,game,"Challenge your friends in fast-paced fantasy soccer matches! Play as 4 different characters, compete in unique game modes, and score as many goals as you can!",Pixel Sunset Studio,Pixel Sunset Studio,"16 Jul, 2019",Casual,Local Multi-Player,English,No,0,USD,2.99,mac
2879980,ZAKO NO AHIRU,game,"You can't clear it, can you, mister? So lame, so lame ♡♡♡",FUファイターズ,FUファイターズ,Q1 2025,Action,Co-op,English,No,0,,,linux
1571200,Project QT,game,"Project QT is a puzzle RPG filled with hot chicks, amazing battles and the naughtiest rewards. Recruit your team of sexy girls and fight the evil infection that has spread into your world. Humanity needs you, so join the greatest and smuttiest adventure in the multiverse!",xDNA,Nutaku Publishing,"16 Jan, 2024",Action,Co-op,English,Si,0,,0.00,windows
1913000,Nuclear Frost,game,"Nuclear Frost is an action-adventure first-person shooter where you have to face the threats that the new world has brought to bear. Fight mutants, keep yourself warm, avoid radiation and fight fungus to save your home.",Broken Singularity,Broken Singularity,"25 Nov, 2024",RPG,Multi-player,English,No,0,USD,1.99,mac
1235520,HENTAI DANCE,game,Dancing? This is very easy! Try this HENTAI DANCE game!,Cyber Keks,Cyber Keks,"13 Feb, 2020",Indie,Single-player,English,No,0,USD,0.99,linux
1244550,HENTAI DANCE Soundtrack,music,9 original game soundtracks HENTAI DANCE.,Cyber Keks,,"1 Mar, 2020",Indie,Co-op,English,No,0,USD,0.99,windows
1066130,Truck Life,game,"Brand new truck simulation game, experience fun from a variety of truck driving. Drive around the original Chinese map, complete hundreds of specialty tasks through different cities. Meet in the mountains, rivers, lakes and seas. Let’s share your truck life.",惊叹号游戏工作室,惊叹号游戏工作室,"6 Aug, 2020",Strategy,Multi-player,English,No,0,USD,19.99,mac
1078760,Motorcycle Mechanic Simulator 2021,game,"Become a motorbike mechanic and build your empire. Buy, repair, renovate, and create your own dreamed custom motorcycle.",Play2Chill S.A.,"PlayWay S.A., Play2Chill S.A.","17 Nov, 2021",Strategy,Multi-player,English,No,0,USD,19.99,windows
