AppID,Nombre,Tipo,Descripcion,Desarrollador,Editor,FechaSalida,Genero,Categoria,Lenguajes,Gratis,EdadRequerida,Moneda,PrecioInicial,Plataforma
1416920,Chinese Online Game,game,"The player will play the role of an older unmarried young man Lao Wang, because of the lack of money for marriage in thinking of ways to accidentally be attracted by the pop-up ads of an online game endorsed by a certain celebrity, and the gears of destiny began to turn at that moment.",648工作室,Wise Games,"18 Jul, 2024",Indie,Single-player,English,No,0,USD,9.99,windows
2200990,Trigger Fever,game,"Engage in chaotic multiplayer battles in Trigger Fever, a top-down shooter party game. Crush foes solo or with friends, wielding 50+ unique weapons. Show off skills, tactically dominate, and embrace the crazy onslaught!",Rotciv,Rotstudio,"23 Jun, 2023",RPG,Local Multi-Player,English,No,0,USD,4.99,linux
1094050,INTERSTELLAR ROGUE,game,"Interstellar Rogue is a Sci-Fi Rogue-like where you go on a one Ship mission to destroy The ultimate Robot enemy of humanity. It's inspired by various Retro greats such as lander, Metroid and Rogue.",KINGSGUARD GAMES,KINGSGUARD GAMES,"11 Jun, 2019",Strategy,Multi-player,English,No,0,USD,4.99,mac
976800,九劫曲：诅咒之地 NINE TRIALS,game,"There are immortals everywhere in Shenzhou. One day, A curse comes. The cursed people will have a mark on their body, known as &quot;indescribable mark&quot;.Until the full moon night,the cursed person will be inhaled into the alien world. Players play one of the immortals and start their own journey to survive.",爱玩工作室,爱玩工作室,"27 Jun, 2019",RPG,Co-op,English,Si,0,,0.00,linux
542550,Plankton,game,"Minimalist style game : plankton simulation, an electronic pet generated by math codes. Under your care it will slowly grow up and evolve.",PanGuoJun,PanGuoJun,"27 Oct, 2016",Adventure,Co-op,English,No,0,USD,0.99,windows
658780,Bomb Chicken,game,"After a freak accident, a seemingly ordinary chicken becomes a bomb laying free range hero. Explore the versatile mechanic of laying bombs in this explosive exploration platformer.",Nitrome,Nitrome,"16 Apr, 2019",Action,Local Multi-Player,English,No,0,USD,14.99,mac
3297510,The Immortal Scripture,game,"《The Immortal Scripture》 is a unique tactical puzzle game, where each level is a puzzle. Solve all the levels to attain the path to immortality, but is it really achievable?",dcm,dcm,2025,Strategy,Online Multi-Player,English,No,0,,,linux
15970,Luxor,game,"Addictive and exciting, Luxor is an action-puzzler that takes you on a thrilling adventure across Ancient Egypt. Isis has enlisted you to battle Set and his evil minions. Use your scarab to shoot and destroy the approaching spheres before they reach the pyramids. Use Isis magic by catching talismans, gems, and Ankh coins.",MumboJumbo,Accelerate Games,"10 Jun, 2008",Strategy,Single-player,English,No,0,USD,9.99,linux
2466830,Trigger Fever Playtest,game,,,,"9 Jun, 2023",Strategy,Local Multi-Player,English,No,0,,,linux
1625610,Bub Block,game,"A fast-paced multiplayer party game with blocks, spinning blades, and ghosts. Oh my!",Roppy Chop Studios,Roppy Chop Studios,"2 Jun, 2021",RPG,Single-player,English,Si,0,,0.00,mac
1434200,Always Surrender,game,"Battle a never ending swarm of enemies, but be sure to surrender before you die...",The Covert Sheep Example,The Covert Sheep Example,"29 Jan, 2024",Casual,Single-player,English,No,0,USD,3.99,mac
292760,Rise of Prussia Gold,game,Rise of Prussia Gold is the new and improved version of AGEODs Seven Years War (1757-1763) game set in Europe. This hugely detailed strategy game was initially released by AGEOD in 2010 and the Gold version adds numerous improvements and additional scenarios that take the game to the next level.,Ageod,Slitherine Ltd.,"7 May, 2014",Adventure,Co-op,English,No,0,USD,19.99,mac
319090,Borderlands: The Pre-Sequel Season Pass,dlc,"Extend the lunar mayhem with the Borderlands: The Pre-Sequel Season Pass featuring new characters, challenges, missions, and more! Harness the power of your good looks with the “Handsome Jack” Character Pack; raise your level cap &amp; battle waves of enemies in The Holodome Onslaught; and two more add-on Packs!","2K Australia, Gearbox Software, Aspyr (Linux)","2K, Aspyr (Linux)","24 Mar, 2015",RPG,Multi-player,English,No,18,USD,69.99,windows
332730,Barbarian Brawl,game,"Barbarian Brawl is a fast-paced, third-person multiplayer brawler, where hoards of angry, dangerous and hungry Barbarians are out to fight, kill and eat ham... Possibly not in that order.",Thrillion,Thrillion,"12 Feb, 2015",Casual,Co-op,English,No,0,USD,4.99,windows
