AppID,Nombre,Tipo,Descripcion,Desarrollador,Editor,FechaSalida,Genero,Categoria,Lenguajes,Gratis,EdadRequerida,Moneda,PrecioInicial,Plataforma
1050850,Automaton Arena,game,Cute Bots That Probably Shouldn't Be Fighting!,Cicada Works Software,Cicada Works Software,"4 Apr, 2019",Strategy,Single-player,English,No,0,USD,0.99,windows
1050900,Die Bloody Nazi Die!,game,"Die Bloody Nazi Die! is 2D CASUAL twin stick shooter randomly generated dungeon crawler with rougue-lite elements. Follow the alien named Kin in his fight to free Sirel, his love, and defeat the regime!",Decimo Studio,Mean Team Studio,"26 Sep, 2019",Adventure,Local Multi-Player,English,No,0,USD,4.99,mac
1050880,Wavey The Rocket,game,"🚀 Play as Wavey the Rocket as he tries to stop the moon from being destroyed by an evil corporation that removes fizz from soda! A precision side scroller like no other, it's hand-crafted and set to some seriously funky hip hop.",UpperRoom Games Ltd,UpperRoom Games Ltd,"7 May, 2020",Strategy,Co-op,English,No,0,USD,10.99,mac
1051060,Cookie Invaders,game,Cookie Invaders is a roguelite shoot 'em up where you utilise a massive skill tree to evolve your ship to defend the earth from legions of invading cookies.,Igniting Spark Games,Igniting Spark Games,"1 Dec, 2020",Adventure,Local Multi-Player,English,No,0,USD,14.99,mac
1051070,Oni Hunters,game,"Journey through Gironia's lands, where monsters roam and secrets await. Battle, fuse creatures, and decide your fate in the grand Monster Jubilee. Ready for the adventure?",Lunar Labs,Lunar Labs,April 2025,Casual,Online Multi-Player,English,No,0,,,linux
1050910,GALAXY MONSTER,game,"The action takes place in the alternative reality. Among far stars, heroes fight monsters on arenas. This fight is eternal.",Small Games,GLD Games,"5 Apr, 2019",Action,Co-op,English,No,0,USD,7.99,windows
1051140,AUSSIE BATTLER TANKS Demo,demo,"AUSSIE BATTLER TANKS ENGLISH SPEAKING ONLY. 8 WW2 TANKS, 2 TO 12 PLAYERS WITH HASSLE FREE MULTIPLAYER HOSTING ON CLOUD NETWORK , 3 GAME MODES TDM CTF CP AND 5 MAPS. HIT POINTS DAMAGE SYSTEM WITH AP AND HE SHELLS, AND EACH TANK HAS ITS INDERVIUAL ADVANTAGES, LIKE DRIVE SPEED- TURRET TURN SPEED- RELOAD TIME- FIRE POWER- DAMAGE POINTS FILE...","Scotia3d, Lovatto studio, Chobi glass",Aussie Battler Games,"30 Apr, 2019",RPG,Co-op,English,Si,0,,0.00,windows
1051130,Trial of the Towers,game,"Confront the Trial of the Towers in this short-and-sweet retro-3D boss rush, inspired by action RPGs and classic games from the '90s. Defeat the bosses and overcome the Trial, no matter how many tries it takes.",William Wofford,William Wofford,"5 Apr, 2019",RPG,Online Multi-Player,English,Si,0,,0.00,windows
1051150,Hentai Mosaique Vip Room 18+ Expansion,dlc,Girls gone nude! DLC offers 6 new nude puzzles. One for each girl in the game,Lil Hentai Games,,"10 Apr, 2019",Adventure,Single-player,English,Si,0,,0.00,windows
1051160,Snowball Rush,game,Snowball Rush is a Runner-Timekiller game about a funny snowball and many obstacles on the way to the foot of the mountain.,Unstoppable Pug Studio,Unstoppable Pug Studio,"5 Apr, 2019",Casual,Local Multi-Player,English,No,0,USD,0.99,linux
1050290,Blob.io,game,The Most EPIC Blobs vs Blobs Online Action battles out here!,Zakhariev Anton,Blob.io,Coming soon,Indie,Co-op,English,Si,0,Coming soon,0.00,mac
