AppID,Nombre,Tipo,Descripcion,Desarrollador,Editor,FechaSalida,Genero,Categoria,Lenguajes,Gratis,EdadRequerida,Moneda,PrecioInicial,Plataforma
1875800,Cubytet,game,Cubytet is a 3D puzzle game in which you need to place pieces of different shapes on the playing field in order to score as many points as possible. This game is based on the world's most famous 2D puzzle game and is its 3D analog with some additional game mechanics!,AP2 Games,AP2 Games,"21 Feb, 2022",RPG,Local Multi-Player,English,No,0,USD,3.99,windows
1875810,Slashers,game,"Slashers is a 1-4 player cooperative horror game, you are explorers of abandoned and seemingly cursed places, your goal is to see what happened there.",HeadArrow,HeadArrow,"10 May, 2022",Action,Multi-player,English,No,0,USD,6.0,windows
1875840,Illusion OST,music,Original tracks of Illusion and BGM not included Created by ：朗奇 Vskzero 可可脂 Cover Artist: 土猫 糖素瘾者,"Animalclaw Of Dreams, Refrigerator game lovers, Dream gear","Refrigerator game lovers , Jam Cafe, Dream gear","1 Mar, 2022",Indie,Multi-player,English,No,0,USD,2.99,linux
1875850,Reds Adventure A Seasons New Beginning,game,"Reds Adventure A Seasons New Beginning is a little, but fun 2D platformer where you play as a red blob fighting through the different levels in each of the 4 different seasons to save the season from the enemies you will encounter. (Although this is not said in the actual game).",CatCorp Studios,CatCorp Studios,"4 Feb, 2022",RPG,Multi-player,English,No,0,USD,3.99,mac
1874930,JUST HOOPS Demo,demo,"Take the live-action of arcade basketball into your living room! Inspired by 80’s arcade basketball, JUST HOOPS is an immersive gaming VR experience that features multiple play modes, challenges, and more than 45 levels of changing hoops!Welcome to our free demo!",Realcast,Realcast,"4 Mar, 2022",Strategy,Co-op,English,Si,0,,0.00,linux
1874950,Runner Party,game,A competitive Multiplayer running game up to 4 players (either on LAN or online) - Use traps and projectiles ! Make life difficult for your competitors ! - Slow down the enemy to get ahead ! - Get hit and you risk losing the race !,Creartstudio,Creartstudio,"22 Dec, 2022",Casual,Multi-player,English,No,0,USD,9.99,linux
1874960,TrinityS - ORIGINAL SOUNDTRACK,music,This is the original soundtrack to the world of &quot;TrinityS&quot;.,Indie-us Games,Indie-us Games,"27 Apr, 2022",Action,Local Multi-Player,English,No,0,USD,6.99,windows
1874990,Fluids & Sounds: Mind relaxing and meditative,game,"Colorful &amp; psychedelic fluids will calm you down, or get you trippy and creative. Use this fluid simulation to escape the daily stress. Take a deep breath and just relax while creating beautiful visuals.","Marvin Krüger, MK Arts and Visuals",MK Arts & Visuals,"3 Feb, 2022",Indie,Single-player,English,No,0,USD,3.99,windows
1874980,Ready for Riot,game,"Immerse into real, hard american prison riot and test out yourself as a member of the police force. Do you have what it takes to control and recapture most dangerous convicts in the world?",Baked Games,"Baked Games, PlayWay S.A.",To be announced,Adventure,Online Multi-Player,English,No,0,To be announced,To be announced,linux
1875030,Interstate Drifter 1999 Soundtrack,music,A nice selection of 8-bit style music!,"Ultimo Games, Runesound",Ultimo Games,"31 Jan, 2022",Casual,Multi-player,English,No,0,USD,2.99,mac
1875080,Supraland Six Inches Under Demo,demo,,Supra Games,Supra Games,"14 Jan, 2022",Strategy,Co-op,English,Si,0,,0.00,windows
