AppID,Nombre,Tipo,Descripcion,Desarrollador,Editor,FechaSalida,Genero,Categoria,Lenguajes,Gratis,EdadRequerida,Moneda,PrecioInicial,Plataforma
2054770,Combo Card Clashers,game,"Combo Card Clashers is a roguelike deckbuilder meets auto battler! Build massive combos by playing all cards each turn. Unlock powerful card synergies, recruit monsters to be your allies, upgrade gears and skills - give it all to brave through a mysterious world.",Burnt Games LLC,"Burnt Games LLC, Erabit","16 May, 2024",Strategy,Co-op,English,No,0,USD,11.99,mac
2075410,初夏倾语 - Summer Whisper,game,这是一段发生在高中校园内纯情青涩的百合恋爱故事。曾经无数次注视她的脸颊，想要将她拥入怀中，让她倾听自己当下的全部情感，却总在她对未来的期望中止步不前……学生时代的恋爱会无疾而终，还是还得偿所愿？,绘夏Games,绘夏Games,"12 Jan, 2023",RPG,Single-player,English,No,0,USD,1.99,linux
2123050,TAKIBI,game,"Forgetting the busyness and coldness of daily life, we sometimes gaze at the flames and then at ourselves. It would be nice to have such a time.",oyajinojiike,oyajinojiike,"21 Oct, 2022",Action,Co-op,English,No,0,USD,3.99,mac
3379120,Wild Script: Nature Playtest,game,,,,"30 Nov, 2024",Action,Co-op,English,No,0,,,windows
2270600,Open At Nine,game,"“Massive debt, a shabby brothel, and a naughty succubus… This is all I get for defeating the Demon God?!” Hire monster girls to attract customers and pay off your debts! Don't forget to give your girls lots of hands-on job training!",Black Cat Entertainment,"Mango Party, Mango Party News","12 Apr, 2023",Adventure,Multi-player,English,No,0,USD,9.99,linux
2224320,Immortals Fenyx Rising™ - Season Pass,dlc,Expand your adventure with the Season Pass! Includes new gameplay experiences and a quest with dedicated in-game reward.,Ubisoft,Ubisoft,"15 Dec, 2022",Adventure,Multi-player,English,No,0,USD,19.99,mac
2487680,Burger Kombat,game,Assemble your most expensive burger from whatever you can find in the kitchen.,"Four Guys, One Burger","Four Guys, One Burger","14 Aug, 2024",Casual,Online Multi-Player,English,Si,0,,0.00,windows
3050760,Sidereal Dominion: Avalon,game,"Rebuild the remnants of humanity and conquer the Milky Way in this grand strategy game. Colonize systems and corner markets, or lead your fleets to victory in real-time battles. Reclaim Earth, or terraform new worlds.",Spatha Games,Spatha Games,"22 Sep, 2024",Indie,Single-player,English,No,0,USD,9.99,windows
2497560,SKIBIDI: ESCAPE FROM TOILETS!,game,&quot;SKIBIDI: ESCAPE FROM TOILETS&quot; is a cooperative horror game for 1-4 players. TV MANs are trying to get through creepy and atmospheric locations that are filled with dangerous SKIBIDI - they want to kill you! Free content updates with new levels and game modes - YES YES YES!,Skibidi Games,Skibidi Games,"30 Nov, 2023",Adventure,Local Multi-Player,English,No,0,USD,4.99,mac
2972310,Herald of the Mists,game,"A text-based RPG with turn-based combat, dice rolls, and difficult choices. Set out on a mysterious quest in The Mists, where truth fades and reality bends.",FromNiki,FromNiki,Coming soon,RPG,Single-player,English,No,0,Coming soon,Coming soon,mac
2985890,EleBall,game,"EleBall is a casual platformer about a circus elephant, who tries their best to catch falling objects while simultaneously keeping balance on a bouncy ball.",Pulsar Twin,Pulsar Twin,Coming soon,Casual,Multi-player,English,Si,0,Coming soon,0.00,mac
3014520,BrokenLore: LOW,game,"LOW, a first-person Horror Game, immerses players in the dark prelude of BrokenLore's story. Set in a mist-shrouded Japanese village, players uncover deep-seated hatred and ancient secrets. Navigate a hyperrealistic, claustrophobic environment where supernatural forces and tragic cycles abound.",Serafini Productions,Serafini Productions,To be announced,Action,Single-player,English,No,0,To be announced,To be announced,linux
2543770,It Was Raining That Night,game,"&quot;It Was Raining That Night&quot; is an erotic visual novel that takes you on an adventure in the world of the mafia. With an engaging storyline and attractive characters, you're sure to get lost in the experience. Will you reign supreme or fall?",VeronicaPerv,Deafperv,"29 May, 2024",RPG,Single-player,English,No,0,USD,11.99,windows
2677930,SleepWalk,game,"Sleepwalk is an indie survival horror game, the story begins with the player waking up in an unknown and dark place, trying to escape and discover hidden secrets with no memory of their arrival.",Richard Bueno,RB Entertainment,"20 Nov, 2023",Adventure,Single-player,English,No,0,USD,1.99,linux
